question,criteria,topic
What is SunGuard eXtraSelective and what makes it different from standard solar control glass?,Answer must mention triple-silver coating and the balance between natural light and solar energy control,SunGuard Product Line
What residential glass product does Guardian offer that combines thermal insulation and solar control for windows?,Answer must reference ClimaGuard Solar and its dual function for renovation and new builds,ClimaGuard Product Line
What light transmission percentage does ClimaGuard Premium2 achieve in triple glazing?,Answer must state 74% visible light transmission for triple glazing configurations,ClimaGuard Premium2 Specs
What building certifications can Guardian Glass products help customers achieve?,Answer must mention both LEED and BREEAM environmental building certifications,Sustainability and Certifications
What is float glass and how is it manufactured?,Answer must describe the float process involving melting raw materials into a hot ribbon then controlled cooling,Float Glass Manufacturing
How does Guardian anti-reflective glass perform in terms of light transmission and CRI?,Answer must state light transmission above 98% and a CRI of 99 for the latest anti-reflective product,Anti-Reflective Glass Performance
What is the color rendering index (CRI) of Guardian anti-reflective glass and why does it matter for retail?,Answer must state CRI of 99 and explain it means colors seen through the glass are nearly identical to unobstructed viewing,Anti-Reflective Glass - Retail Applications
What percentage of UV rays can the interlayer in laminated glass absorb?,Answer must state up to 99% of UV rays absorbed by the laminated glass interlayer,Laminated Glass - UV Protection
What is Guardian LamiGlass and what performance benefits does it provide?,Answer must mention two or more panes bonded with PVB interlayers and the range of configurable performance options,LamiGlass Product Line
What security glass applications are covered by Guardian Glass in Europe?,Answer must include at least two of: forced entry resistance for banks/museums; ballistic resistance for embassies/courts; blast protection for federal buildings,Security Glass Applications
How does Guardian Glass describe the two types of glare?,Answer must distinguish discomfort glare from disability glare,Glare Control - Technical Concepts
What visible light transmission level does Guardian recommend for areas with significant glare concerns?,Answer must state 45% VLT or lower for west-facing or south-facing elevations or high window-to-wall ratios,Glare Control - Recommendations
What is the light reflection level of Guardian anti-reflective glass in its double-sided version?,Answer must state reflection reduced to 0.6% compared to approximately 8% for standard uncoated float glass,Anti-Reflective Glass - Technical Specs
What product is recommended for storefront applications to maximize visibility and reduce reflections?,Answer must mention Guardian Clarity Neutral as the solution for storefronts where reflections disturb the view,Storefront Glass Solutions
What safety feature can be combined with anti-reflective glass for storefront security?,Answer must mention combining anti-reflective glass with laminated glass for burglary resistance and injury prevention,Storefront Glass - Safety and Security
What is the U-value achieved by ClimaGuard 1.0+ in a standard double insulating glass unit?,Answer must state a U-value of 1.0 W/m2K and light transmission of 76% for a 4-16-4 panel configuration,ClimaGuard 1.0+ Technical Specs
What does the Guardian Sun product protect against and in which conditions?,Answer must describe protection from both cold and heat and suitability for large glazed areas with high sun exposure,Guardian Sun Product
What makes float glass suitable as a base for further glass processing?,Answer must mention that float glass can be tempered / laminated / painted / coated and used as a substrate for low-E coatings,Float Glass - Processing Versatility
What environmental advantage does using glass cullet in float glass production provide?,Answer must mention reduced energy requirements and lower consumption of natural raw materials during production,Float Glass - Sustainability
What is the role of low-E coatings in high-performance architectural glass?,Answer must explain that low-E coatings reduce thermal energy loss and/or solar heat gain while maintaining natural light transmission,Low-E Coatings - Function
For which construction types is ClimaGuard Solar particularly suited?,Answer must mention renovation projects and new residential builds as primary use cases,ClimaGuard Solar - Applications
What is Guardian Bird1st and what problem does it address?,Answer must indicate it is a bird-friendly glass product designed to reduce bird collisions with glass facades,Bird-Friendly Glass
What is the main function of acoustic glass from Guardian?,Answer must describe reduction of external noise transmission as its primary purpose for occupant comfort,Acoustic Glass Function
How does Guardian describe the role of architectural glass in energy-efficient buildings?,Answer must reference reducing operational carbon emissions and improving energy performance through advanced glazing,Architectural Glass - Energy Efficiency
What types of interior applications does Guardian Glass support?,Answer must include at least two from: balustrades / flooring / partitions / decorative panels / picture framing glass / doors,Interior Glass Applications
What is Guardian UltraClear and what makes it visually distinct?,Answer must describe it as a low-iron glass with high clarity and neutral color suitable for architectural and specialty applications,UltraClear Product
What is the anti-reflective coating standard for glass reflection in a single-sided vs double-sided application?,Answer must distinguish the reflection performance between single-sided and double-sided coated versions of Guardian anti-reflective glass,Anti-Reflective Glass - Coating Variants
What advantage does Guardian ClimaGuard Premium2 provide for glass producers in terms of logistics?,Answer must mention it is a universal product for both double and triple glazing reducing the need to stock multiple products,ClimaGuard Premium2 - Logistics Benefit
How does solar control coated glass interact with the electromagnetic spectrum?,Answer must reference UV / visible / near-infrared wavelengths in the 300 to 2500 nm range and the reflecting/absorbing mechanism of coatings,Solar Control Glass - Technical Mechanism
What distinguishes storefront glazing requirements from standard commercial glazing?,Answer must mention the need for lowest possible reflection combined with highest transparency and UV protection for displayed products,Storefront Glass - Performance Requirements
